{
  "$schema": "https://json-schema.org/draft/2020-12/schema",
  "title": "Grammar",
  "type": "object",
  "properties": {
    "containers": {
      "type": "array",
      "items": {
        "$ref": "#/$defs/ContainerKind"
      },
      "maxItems": 32,
      "minItems": 1
    },
    "items": {
      "type": "array",
      "items": {
        "$ref": "#/$defs/ItemKind"
      },
      "maxItems": 32,
      "minItems": 1
    },
    "lines": {
      "description": "A house style per line: how routed links of that line draw their bends.",
      "type": "array",
      "items": {
        "$ref": "#/$defs/LineKind"
      },
      "maxItems": 4
    },
    "name": {
      "type": "string",
      "pattern": "^[a-z][a-z0-9-]{0,31}$"
    },
    "remembered": {
      "type": "array",
      "items": {
        "$ref": "#/$defs/Remembered"
      },
      "maxItems": 64
    }
  },
  "additionalProperties": false,
  "required": [
    "name",
    "containers",
    "items",
    "remembered"
  ],
  "$defs": {
    "Bend": {
      "description": "The curve a routed link takes through a bend: a quarter circle, a cubic whose control\npoints both sit on the corner, which meets each leg with no jump in curvature, or a\nspline: a quadratic from the middle of one leg to the middle of the next with its control\npoint on the corner, so the whole route is one smooth curve.",
      "type": "string",
      "enum": [
        "arc",
        "curve",
        "spline"
      ]
    },
    "BorderPattern": {
      "oneOf": [
        {
          "type": "string",
          "enum": [
            "solid",
            "dashed",
            "dotted",
            "none"
          ]
        },
        {
          "description": "A long dash and a dot: an assembly outline on a design sheet.",
          "type": "string",
          "const": "dash-dot"
        }
      ]
    },
    "ContainerKind": {
      "type": "object",
      "properties": {
        "border": {
          "$ref": "#/$defs/KindBorder"
        },
        "default_tint": {
          "type": [
            "integer",
            "null"
          ],
          "format": "uint8",
          "maximum": 8,
          "minimum": 1
        },
        "label": {
          "$ref": "#/$defs/LabelStyle"
        },
        "name": {
          "type": "string",
          "pattern": "^[a-z][a-z0-9-]{0,31}$"
        },
        "padding": {
          "type": "number",
          "format": "float",
          "maximum": 32.0,
          "minimum": 0.0
        },
        "parents": {
          "type": "array",
          "items": {
            "type": "string"
          },
          "minItems": 1
        },
        "radius": {
          "type": "number",
          "format": "float",
          "maximum": 16.0,
          "minimum": 0.0
        },
        "role": {
          "$ref": "#/$defs/Role"
        },
        "tintable": {
          "type": "boolean"
        },
        "tone": {
          "anyOf": [
            {
              "$ref": "#/$defs/Tone"
            },
            {
              "type": "null"
            }
          ]
        }
      },
      "additionalProperties": false,
      "required": [
        "name",
        "role",
        "tintable",
        "border",
        "padding",
        "radius",
        "label",
        "parents"
      ]
    },
    "IconClass": {
      "oneOf": [
        {
          "description": "From the archive's Unique Icons: stands for one product.",
          "type": "string",
          "const": "product"
        },
        {
          "description": "From the archive's Category Icons: stands for a product family.",
          "type": "string",
          "const": "category"
        }
      ]
    },
    "IconName": {
      "type": "string",
      "enum": [
        "agents",
        "ai-ml",
        "bigquery",
        "cloud-run-flat",
        "cloud-run",
        "cloud-sql",
        "cloud-storage",
        "compute-engine",
        "compute",
        "containers",
        "data-analytics",
        "databases",
        "devops",
        "gke",
        "hybrid",
        "integration",
        "networking",
        "observability",
        "scc",
        "security-identity",
        "serverless",
        "storage",
        "vertex-ai"
      ]
    },
    "IconPack": {
      "type": "string",
      "enum": [
        "gcp",
        "none"
      ]
    },
    "IconProducts": {
      "type": "object",
      "properties": {
        "class": {
          "$ref": "#/$defs/IconClass"
        },
        "icon": {
          "$ref": "#/$defs/IconName"
        },
        "names": {
          "type": "array",
          "items": {
            "type": "string"
          },
          "minItems": 1
        },
        "shape": {
          "description": "Under iso, the solid an item with this icon stands as; absent is card.",
          "anyOf": [
            {
              "$ref": "#/$defs/Shape"
            },
            {
              "type": "null"
            }
          ]
        }
      },
      "additionalProperties": false,
      "required": [
        "icon",
        "class",
        "names"
      ]
    },
    "ItemKind": {
      "type": "object",
      "properties": {
        "icons": {
          "$ref": "#/$defs/IconPack"
        },
        "name": {
          "type": "string",
          "pattern": "^[a-z][a-z0-9-]{0,31}$"
        },
        "parents": {
          "type": "array",
          "items": {
            "type": "string"
          },
          "minItems": 1
        },
        "products": {
          "type": "array",
          "items": {
            "$ref": "#/$defs/IconProducts"
          }
        },
        "shape": {
          "description": "Under iso, the solid an item of this kind stands as when neither the item nor its\nicon's row names one; absent is card.",
          "anyOf": [
            {
              "$ref": "#/$defs/Shape"
            },
            {
              "type": "null"
            }
          ]
        }
      },
      "additionalProperties": false,
      "required": [
        "name",
        "icons",
        "products",
        "parents"
      ]
    },
    "KindBorder": {
      "type": "object",
      "properties": {
        "pattern": {
          "$ref": "#/$defs/BorderPattern"
        },
        "width": {
          "type": "number",
          "format": "float",
          "maximum": 4.0,
          "minimum": 0.0
        }
      },
      "additionalProperties": false,
      "required": [
        "pattern",
        "width"
      ]
    },
    "LabelStyle": {
      "oneOf": [
        {
          "description": "The zone label style.",
          "type": "string",
          "const": "plain"
        },
        {
          "description": "The perimeter label style.",
          "type": "string",
          "const": "accent"
        },
        {
          "description": "The gcp bar label, frame kinds only.",
          "type": "string",
          "const": "bar"
        },
        {
          "description": "A tab straddling the top border, on a design sheet: an assembly's name.",
          "type": "string",
          "const": "tab"
        }
      ]
    },
    "Line": {
      "type": "string",
      "enum": [
        "gray",
        "solid",
        "dash",
        "deny"
      ]
    },
    "LineKind": {
      "description": "The bends of the routed links of one line, which win over the page's `corner` and\n`bend`.",
      "type": "object",
      "properties": {
        "bend": {
          "anyOf": [
            {
              "$ref": "#/$defs/Bend"
            },
            {
              "type": "null"
            }
          ]
        },
        "corner": {
          "type": [
            "number",
            "null"
          ],
          "format": "float",
          "maximum": 16.0,
          "minimum": 0.0
        },
        "line": {
          "$ref": "#/$defs/Line"
        }
      },
      "additionalProperties": false,
      "required": [
        "line"
      ]
    },
    "Remembered": {
      "type": "object",
      "properties": {
        "literal": {
          "type": "string",
          "maxLength": 64,
          "minLength": 1
        },
        "reason": {
          "type": "string",
          "maxLength": 400,
          "minLength": 1
        }
      },
      "additionalProperties": false,
      "required": [
        "literal",
        "reason"
      ]
    },
    "Role": {
      "oneOf": [
        {
          "description": "The outermost system or cloud: a bar holding the label over a body.",
          "type": "string",
          "const": "frame"
        },
        {
          "description": "A network, trust or security edge.",
          "type": "string",
          "const": "boundary"
        },
        {
          "description": "A locality, cluster or site.",
          "type": "string",
          "const": "group"
        },
        {
          "description": "An ownership scope: a project, folder or account.",
          "type": "string",
          "const": "tile"
        }
      ]
    },
    "Shape": {
      "description": "The solid an item stands as under iso (section 12.3): a card is the flat card raised,\nwith its content on top; every other shape carries the icon on its top and its text\non the floor beside it. Tile: a thin plate, for network and edge pieces. Tower: a tall\nnarrow box, for compute, clusters and nodes. Cylinder: databases and warehouses.\nStack: three stacked discs, for storage and buckets. Block: a card-height box of a\nfixed footprint with its text on the floor, the default of an icon-bearing kind. Figure:\na standing person, for users and operators. Laptop and phone: client devices.",
      "type": "string",
      "enum": [
        "card",
        "tile",
        "tower",
        "cylinder",
        "stack",
        "block",
        "figure",
        "laptop",
        "phone"
      ]
    },
    "Tone": {
      "type": "string",
      "enum": [
        "neutral",
        "warm",
        "cool",
        "soft",
        "strong",
        "highlight",
        "emphasis",
        "accent"
      ]
    }
  }
}
